<!-- WDR25 DTD from styles (tiny v2.1, recursive) --><!-- Generated: 2025-10-08T15:25:01Z --><!ELEMENT Root (Story)><!ELEMENT Story ANY><!ELEMENT actor (#PCDATA)><!ELEMENT age-testimonials (#PCDATA)><!ELEMENT ambiguous (#PCDATA)><!ELEMENT answer (#PCDATA)><!ELEMENT bar (#PCDATA)><!ELEMENT bar-ex-afr (#PCDATA)><!ELEMENT bar-ex-am (#PCDATA)><!ELEMENT bar-explainer (#PCDATA)><!ELEMENT bibliography (#PCDATA)><!ELEMENT bibliography-first (#PCDATA)><!ELEMENT big-opening-quote-mark (#PCDATA)><!ELEMENT big-opening-quote-mark-yellow (#PCDATA)><!ELEMENT big-quote (#PCDATA)><!ELEMENT big-quote-author (#PCDATA)><!ELEMENT blueana ANY><!ELEMENT body-cell (#PCDATA)><!ELEMENT body-cell-core (#PCDATA)><!ELEMENT body-cell-core-last (#PCDATA)><!ELEMENT body-cell-core-next (#PCDATA)><!ELEMENT body-cell-fact (#PCDATA)><!ELEMENT body-fact (#PCDATA)><!ELEMENT body-left (#PCDATA)><!ELEMENT body-margin-box (#PCDATA)><!ELEMENT body-right (#PCDATA)><!ELEMENT bold (#PCDATA)><!ELEMENT bold-footer-small (#PCDATA)><!ELEMENT bold-italic (#PCDATA)><!ELEMENT bold-table (#PCDATA)><!ELEMENT book-subtitle (#PCDATA)><!ELEMENT book-title (#PCDATA)><!ELEMENT box-normal (#PCDATA)><!ELEMENT bullet-a (#PCDATA)><!ELEMENT bullet-body (#PCDATA)><!ELEMENT bullet-caption (#PCDATA)><!ELEMENT bullet-case-studies-icon (#PCDATA)><!ELEMENT bullet-ebn-icon (#PCDATA)><!ELEMENT bullet-ebn-icon-yellow (#PCDATA)><!ELEMENT bullet-list (#PCDATA)><!ELEMENT bullet-list-first (#PCDATA)><!ELEMENT bullet-q (#PCDATA)><!ELEMENT bullet-q-a-icon (#PCDATA)><!ELEMENT bullet-q6a-icon-alt-2 (#PCDATA)><!ELEMENT bullet-sublist (#PCDATA)><!ELEMENT caption (#PCDATA)><!ELEMENT caption-12c (#PCDATA)><!ELEMENT caption-2c (#PCDATA)><!ELEMENT caption-3c (#PCDATA)><!ELEMENT caption-4c (#PCDATA)><!ELEMENT caption-6c (#PCDATA)><!ELEMENT caption-anchor (#PCDATA)><!ELEMENT caption-anchor-core-chapter-image (#PCDATA)><!ELEMENT caption-box (#PCDATA)><!ELEMENT caption-chapter-core ANY><!ELEMENT caption-column ANY><!ELEMENT caption-contribution-images (#PCDATA)><!ELEMENT caption-margin ANY><!ELEMENT chapter-icon (#PCDATA)><!ELEMENT chapter-matrix (#PCDATA)><!ELEMENT chapter-number (#PCDATA)><!ELEMENT chapter-quote (#PCDATA)><!ELEMENT chapter-section (#PCDATA)><!ELEMENT chapter-title (#PCDATA)><!ELEMENT chapter-title-alt (#PCDATA)><!ELEMENT closing-quote-mark (#PCDATA)><!ELEMENT contact (#PCDATA)><!ELEMENT content-type (#PCDATA)><!ELEMENT content-type-cs (#PCDATA)><!ELEMENT content-type-insights (#PCDATA)><!ELEMENT content-type-q-a (#PCDATA)><!ELEMENT content-type-spotlight (#PCDATA)><!ELEMENT content-type-testimonials (#PCDATA)><!ELEMENT contribution-section-white (#PCDATA)><!ELEMENT contributor (#PCDATA)><!ELEMENT contributor-2c (#PCDATA)><!ELEMENT contributor-3c (#PCDATA)><!ELEMENT contributor-3c-first (#PCDATA)><!ELEMENT contributor-name-case-study (#PCDATA)><!ELEMENT contributor-name-ebn (#PCDATA)><!ELEMENT contributor-name-insights (#PCDATA)><!ELEMENT contributor-name-q-a (#PCDATA)><!ELEMENT contributor-name-spotlight (#PCDATA)><!ELEMENT contributor-name-testimonials (#PCDATA)><!ELEMENT contributor-name-vff (#PCDATA)><!ELEMENT contributor-position-case-study (#PCDATA)><!ELEMENT contributor-position-ebn (#PCDATA)><!ELEMENT contributor-position-insights (#PCDATA)><!ELEMENT contributor-position-q-a (#PCDATA)><!ELEMENT contributor-position-spotlight (#PCDATA)><!ELEMENT contributor-position-testimonials (#PCDATA)><!ELEMENT contributor-position-vff (#PCDATA)><!ELEMENT contributor-role (#PCDATA)><!ELEMENT contributor-role-2c (#PCDATA)><!ELEMENT contributor-role-3c (#PCDATA)><!ELEMENT core-chapter-tiktok-title ANY><!ELEMENT cover-blue ANY><!ELEMENT cover-red ANY><!ELEMENT credit-img (#PCDATA)><!ELEMENT cross-reference-link (#PCDATA)><!ELEMENT dimensions (#PCDATA)><!ELEMENT disclaimer ANY><!ELEMENT drop-cap-foreword (#PCDATA)><!ELEMENT dropcaps-bold-box-first (#PCDATA)><!ELEMENT dropcaps-box-first (#PCDATA)><!ELEMENT endnote (#PCDATA)><!ELEMENT fig ANY><!ELEMENT fig-num (#PCDATA)><!ELEMENT figure-description (#PCDATA)><!ELEMENT figure-description-white (#PCDATA)><!ELEMENT figure-description_numbered (#PCDATA)><!ELEMENT folio (#PCDATA)><!ELEMENT folio-white (#PCDATA)><!ELEMENT footer-cell (#PCDATA)><!ELEMENT footer-cell-core (#PCDATA)><!ELEMENT footer-col-cell-core (#PCDATA)><!ELEMENT footer-left (#PCDATA)><!ELEMENT footer-right (#PCDATA)><!ELEMENT footnote-number (#PCDATA)><!ELEMENT footnote-reference (#PCDATA)><!ELEMENT footnote-seperator (#PCDATA)><!ELEMENT footnotes (#PCDATA)><!ELEMENT footnotes-first (#PCDATA)><!ELEMENT footnotes-next (#PCDATA)><!ELEMENT foreword-body ANY><!ELEMENT guards-a-background ANY><!ELEMENT guards-b-background ANY><!ELEMENT guards-c-background ANY><!ELEMENT h.fig-number (#PCDATA)><!ELEMENT h0 (#PCDATA)><!ELEMENT h00 (#PCDATA)><!ELEMENT h1 (#PCDATA)><!ELEMENT h1-anx (#PCDATA)><!ELEMENT h1-anx-wide (#PCDATA)><!ELEMENT h1-bibliography (#PCDATA)><!ELEMENT h1-c1 (#PCDATA)><!ELEMENT h1-case-study (#PCDATA)><!ELEMENT h1-chapter-matrix (#PCDATA)><!ELEMENT h1-contributor (#PCDATA)><!ELEMENT h1-contributor-2c (#PCDATA)><!ELEMENT h1-contributor-3c (#PCDATA)><!ELEMENT h1-contributor-case-study (#PCDATA)><!ELEMENT h1-contributor-ebn (#PCDATA)><!ELEMENT h1-contributor-insights (#PCDATA)><!ELEMENT h1-contributor-q-a (#PCDATA)><!ELEMENT h1-contributor-spotlight (#PCDATA)><!ELEMENT h1-contributor-testimonials (#PCDATA)><!ELEMENT h1-contributor-vff (#PCDATA)><!ELEMENT h1-ebn (#PCDATA)><!ELEMENT h1-endnotes (#PCDATA)><!ELEMENT h1-example-matrix (#PCDATA)><!ELEMENT h1-first (#PCDATA)><!ELEMENT h1-harm (#PCDATA)><!ELEMENT h1-icon-topo (#PCDATA)><!ELEMENT h1-index (#PCDATA)><!ELEMENT h1-insights (#PCDATA)><!ELEMENT h1-next (#PCDATA)><!ELEMENT h1-number (#PCDATA)><!ELEMENT h1-principles (#PCDATA)><!ELEMENT h1-quote (#PCDATA)><!ELEMENT h1-sidenote-context (#PCDATA)><!ELEMENT h1-sidenotes-contributions (#PCDATA)><!ELEMENT h1-sidenotes-icon (#PCDATA)><!ELEMENT h1-spotlight (#PCDATA)><!ELEMENT h1-table (#PCDATA)><!ELEMENT h1-table-anx (#PCDATA)><!ELEMENT h1-testimonials (#PCDATA)><!ELEMENT h1-title-4l (#PCDATA)><!ELEMENT h1-title-5l (#PCDATA)><!ELEMENT h1-vff (#PCDATA)><!ELEMENT h1.1 (#PCDATA)><!ELEMENT h1.1-first (#PCDATA)><!ELEMENT h1.1-number (#PCDATA)><!ELEMENT h1.1.1 (#PCDATA)><!ELEMENT h1.1.1-number (#PCDATA)><!ELEMENT h1.1.1-restart (#PCDATA)><!ELEMENT h1.1.1.1 (#PCDATA)><!ELEMENT h1.1.1.1-number (#PCDATA)><!ELEMENT h1.1.1.1-restart (#PCDATA)><!ELEMENT h1.box (#PCDATA)><!ELEMENT h1.fig (#PCDATA)><!ELEMENT h1.fig-light (#PCDATA)><!ELEMENT h1.fig-light-next (#PCDATA)><!ELEMENT h1.fig-next (#PCDATA)><!ELEMENT h1.q-a (#PCDATA)><!ELEMENT h1.q-a-alt (#PCDATA)><!ELEMENT h1.q-a-alt-2 (#PCDATA)><!ELEMENT h1.q-a-alt-3 (#PCDATA)><!ELEMENT h1c2 (#PCDATA)><!ELEMENT h2 (#PCDATA)><!ELEMENT h2-case-study (#PCDATA)><!ELEMENT h2-case-study-numbered (#PCDATA)><!ELEMENT h2-case-study-numbered-first (#PCDATA)><!ELEMENT h2-ebn (#PCDATA)><!ELEMENT h2-insights (#PCDATA)><!ELEMENT h2-keep (#PCDATA)><!ELEMENT h2c1 (#PCDATA)><!ELEMENT h2c2 (#PCDATA)><!ELEMENT h3c2 (#PCDATA)><!ELEMENT hc (#PCDATA)><!ELEMENT header-background-purple ANY><!ELEMENT header-background-violet ANY><!ELEMENT header-background-yellow ANY><!ELEMENT header-cell (#PCDATA)><!ELEMENT header-left (#PCDATA)><!ELEMENT header-right (#PCDATA)><!ELEMENT header-txt ANY><!ELEMENT heading-1-box (#PCDATA)><!ELEMENT heading-3 (#PCDATA)><!ELEMENT heading-cell-core (#PCDATA)><!ELEMENT heading-celle-core-right (#PCDATA)><!ELEMENT hn (#PCDATA)><!ELEMENT hot-take (#PCDATA)><!ELEMENT humanity (#PCDATA)><!ELEMENT hyperlink (#PCDATA)><!ELEMENT hyperlink-email (#PCDATA)><!ELEMENT hyperlink-resources (#PCDATA)><!ELEMENT hyperlink-sources (#PCDATA)><!ELEMENT hyperlink-website (#PCDATA)><!ELEMENT hyperlinks-bio (#PCDATA)><!ELEMENT hyperlinks-italic-bio (#PCDATA)><!ELEMENT icon-contact (#PCDATA)><!ELEMENT icon-hot-take (#PCDATA)><!ELEMENT icon-photo (#PCDATA)><!ELEMENT icon-resources (#PCDATA)><!ELEMENT icon-website (#PCDATA)><!ELEMENT img-12c (#PCDATA)><!ELEMENT img-1c (#PCDATA)><!ELEMENT img-1c-next (#PCDATA)><!ELEMENT img-2c (#PCDATA)><!ELEMENT img-3c (#PCDATA)><!ELEMENT img-4c (#PCDATA)><!ELEMENT img-6c (#PCDATA)><!ELEMENT img-anchor ANY><!ELEMENT img-box (#PCDATA)><!ELEMENT img-chapter (#PCDATA)><!ELEMENT img-chapter-blue ANY><!ELEMENT img-chapter-contribution ANY><!ELEMENT img-chapter-core ANY><!ELEMENT img-chapter-core-full-frame ANY><!ELEMENT img-chapter-core-full-frame-blue ANY><!ELEMENT img-chapter-core-full-frame-red ANY><!ELEMENT img-chapter-red ANY><!ELEMENT img-column ANY><!ELEMENT img-margin ANY><!ELEMENT index-level-1 (#PCDATA)><!ELEMENT index-section-head (#PCDATA)><!ELEMENT intensional (#PCDATA)><!ELEMENT intent-ambiguous (#PCDATA)><!ELEMENT intent-intentional (#PCDATA)><!ELEMENT intent-unintentional (#PCDATA)><!ELEMENT intro (#PCDATA)><!ELEMENT intro-chapter ANY><!ELEMENT introduction (#PCDATA)><!ELEMENT italic-bio (#PCDATA)><!ELEMENT left-col-cell (#PCDATA)><!ELEMENT left-col-cell-core (#PCDATA)><!ELEMENT left-col-cell-core-last (#PCDATA)><!ELEMENT left-col-core (#PCDATA)><!ELEMENT letterhead (#PCDATA)><!ELEMENT light (#PCDATA)><!ELEMENT light-italic (#PCDATA)><!ELEMENT list-number-body (#PCDATA)><!ELEMENT list-number-sublist (#PCDATA)><!ELEMENT matrix (#PCDATA)><!ELEMENT matrix-big (#PCDATA)><!ELEMENT matrix-chapter-explainer ANY><!ELEMENT model (#PCDATA)><!ELEMENT navigation-link (#PCDATA)><!ELEMENT nb (#PCDATA)><!ELEMENT nonebreaking (#PCDATA)><!ELEMENT normal (#PCDATA)><!ELEMENT normal-2c (#PCDATA)><!ELEMENT normal-bullet-list (#PCDATA)><!ELEMENT normal-bullet-list-first (#PCDATA)><!ELEMENT normal-case-study (#PCDATA)><!ELEMENT normal-date (#PCDATA)><!ELEMENT normal-ebn (#PCDATA)><!ELEMENT normal-ebn-first (#PCDATA)><!ELEMENT normal-first (#PCDATA)><!ELEMENT normal-first-drop-cap (#PCDATA)><!ELEMENT normal-insights (#PCDATA)><!ELEMENT normal-lth (#PCDATA)><!ELEMENT normal-nested-bold (#PCDATA)><!ELEMENT normal-nxt (#PCDATA)><!ELEMENT normal-principles (#PCDATA)><!ELEMENT normal-psition (#PCDATA)><!ELEMENT normal-spotlight (#PCDATA)><!ELEMENT normal-spotlight-bullet-list (#PCDATA)><!ELEMENT normal-spotlight-first (#PCDATA)><!ELEMENT normal-table (#PCDATA)><!ELEMENT normal-table-right (#PCDATA)><!ELEMENT normal-testimonials (#PCDATA)><!ELEMENT normal-vff (#PCDATA)><!ELEMENT numbered-list (#PCDATA)><!ELEMENT numbered-list-restart (#PCDATA)><!ELEMENT numbered-sublist (#PCDATA)><!ELEMENT opening-quote-mark (#PCDATA)><!ELEMENT opening-quote-mark-yellow (#PCDATA)><!ELEMENT paragraph-style-2 (#PCDATA)><!ELEMENT pipe (#PCDATA)><!ELEMENT question (#PCDATA)><!ELEMENT question-first (#PCDATA)><!ELEMENT quote-insights (#PCDATA)><!ELEMENT quote-testimonials (#PCDATA)><!ELEMENT quote-vff (#PCDATA)><!ELEMENT recommendations ANY><!ELEMENT redana ANY><!ELEMENT regular (#PCDATA)><!ELEMENT regular-italic (#PCDATA)><!ELEMENT regular-no.-2-italic (#PCDATA)><!ELEMENT resources (#PCDATA)><!ELEMENT rest (#PCDATA)><!ELEMENT rh-bold (#PCDATA)><!ELEMENT rh-chapter-number (#PCDATA)><!ELEMENT rh-chapter-title (#PCDATA)><!ELEMENT rh-chpter-number-white (#PCDATA)><!ELEMENT rh-section-number (#PCDATA)><!ELEMENT right-col-cell (#PCDATA)><!ELEMENT right-col-cell-core (#PCDATA)><!ELEMENT right-col-cell-core-last (#PCDATA)><!ELEMENT right-col-core (#PCDATA)><!ELEMENT right-col-core-next (#PCDATA)><!ELEMENT running-header (#PCDATA)><!ELEMENT running-header-multi-line-1 (#PCDATA)><!ELEMENT running-header-multi-line-2 (#PCDATA)><!ELEMENT running-header-right (#PCDATA)><!ELEMENT running-header-white (#PCDATA)><!ELEMENT semantic ANY><!ELEMENT sidenotes-contribution-cbck ANY><!ELEMENT sidenotes-contribution-wbck ANY><!ELEMENT sidenotes-contribution-wbck-chap ANY><!ELEMENT sidenotes-contribution-wbck-chap-bottom ANY><!ELEMENT sidenotes-contributions (#PCDATA)><!ELEMENT sidenotes-contributions-2col (#PCDATA)><!ELEMENT sidenotes-contributions-first (#PCDATA)><!ELEMENT sidenotes-core (#PCDATA)><!ELEMENT sidenotes-foreword ANY><!ELEMENT sidenotes-matrix ANY><!ELEMENT small-quote (#PCDATA)><!ELEMENT small-quote-author (#PCDATA)><!ELEMENT source (#PCDATA)><!ELEMENT source-white (#PCDATA)><!ELEMENT subchapter-title (#PCDATA)><!ELEMENT subh-left (#PCDATA)><!ELEMENT subh-right (#PCDATA)><!ELEMENT subtitle (#PCDATA)><!ELEMENT subtitle-p9 (#PCDATA)><!ELEMENT subyears-right (#PCDATA)><!ELEMENT super-body-left (#PCDATA)><!ELEMENT super-body-right (#PCDATA)><!ELEMENT super-digit-left (#PCDATA)><!ELEMENT super-digit-right (#PCDATA)><!ELEMENT superscript (#PCDATA)><!ELEMENT t-header-left (#PCDATA)><!ELEMENT t-header-right (#PCDATA)><!ELEMENT t-normal-left (#PCDATA)><!ELEMENT t-normal-right (#PCDATA)><!ELEMENT t-subheader-left (#PCDATA)><!ELEMENT t-subheader-right (#PCDATA)><!ELEMENT t-superbody-left (#PCDATA)><!ELEMENT t-superbody-right (#PCDATA)><!ELEMENT t-superdigit-left (#PCDATA)><!ELEMENT table-anx (#PCDATA)><!ELEMENT table-fact ANY><!ELEMENT table-matrix ANY><!ELEMENT table-semantic ANY><!ELEMENT table-simple ANY><!ELEMENT tables-anx ANY><!ELEMENT tables-left (#PCDATA)><!ELEMENT tables-right (#PCDATA)><!ELEMENT thin-table (#PCDATA)><!ELEMENT tiktok-chapter-heading ANY><!ELEMENT title (#PCDATA)><!ELEMENT title-chapter ANY><!ELEMENT title-cover ANY><!ELEMENT title-p9 (#PCDATA)><!ELEMENT title-principles (#PCDATA)><!ELEMENT title-spine (#PCDATA)><!ELEMENT toh (#PCDATA)><!ELEMENT toh-cell (#PCDATA)><!ELEMENT toh-next (#PCDATA)><!ELEMENT txt-3c-anx ANY><!ELEMENT txt-body ANY><!ELEMENT txt-chapter-core ANY><!ELEMENT txt-chapter-img-core ANY><!ELEMENT txt-endnote ANY><!ELEMENT txt-guard-chapter ANY><!ELEMENT txt-guard-contribution ANY><!ELEMENT txt-principles ANY><!ELEMENT type-of-harm (#PCDATA)><!ELEMENT type-of-harm-2 (#PCDATA)><!ELEMENT unitensional (#PCDATA)><!ELEMENT website (#PCDATA)><!ELEMENT year (#PCDATA)>