<?xml version="1.0" encoding="UTF-8" standalone="no"?>
<!DOCTYPE Story SYSTEM "/Users/ylfch/Dropbox/Innovation Team/Solferino Academy/Solferino Academy 2025 - DBX/WDR25/PROD/LAYOUT/FRENCH/02_EXPORTS/DTD/SYNTHESIS/04_FORE/wdr25_from_styles.dtd" [
]>
<Story>
    <fig href_fmt="images/v-LBN0443_fmt.png" href="file://images/v-LBN0443.png"></fig>
    <Story>
        <chapter-number>Avant-propos</chapter-number>
        <chapter-title>Par Jagan Chapagain </chapter-title>
        <chapter-subtitle>Secrétaire général, Fédération internationale des Sociétés de la
            Croix-Rouge et du Croissant-Rouge</chapter-subtitle>
        <normal>Dans toutes les crises dont j&#8217;ai été témoin &#8211; et dans toutes les
            interventions menées par le réseau international de la Croix-Rouge et du Croissant-Rouge
            en réponse à une catastrophe, à une urgence de santé publique, à un déplacement massif
            de population ou aux conséquences humanitaires d&#8217;un conflit armé &#8211;,
            l&#8217;information est aussi essentielle que la nourriture, l&#8217;eau et le logement.
            Elle guide les personnes vers la sécurité, les relie à leurs proches et leur donne les
            connaissances nécessaires pour se protéger et protéger <nonebreaking>leur </nonebreaking>
            communauté. </normal>
        <normal>Mais l&#8217;information peut aussi causer du tort. Lorsqu&#8217;elle est fausse,
            trompeuse ou délibérément manipulée, elle peut aggraver la peur, alimenter la
            discrimination, entraver l&#8217;accès humanitaire et coûter des vies. Nous
            l&#8217;avons trop souvent constaté : lors d&#8217;épidémies, quand les rumeurs prennent
            le pas sur les conseils sanitaires ; après des catastrophes, quand la méfiance entrave
            l&#8217;acheminement de l&#8217;aide ; et dans les conflits armés, quand les discours
            incendiaires exacerbent <nonebreaking>la </nonebreaking>violence. </normal>
        <normal>Les informations préjudiciables ne sont pas nouvelles, mais elles circulent
            aujourd&#8217;hui à une vitesse et à une échelle sans précédent. Les plateformes
            numériques ouvrent des canaux essentiels pour faire entendre la voix des communautés,
            mais elles constituent également un terrain fertile pour les mensonges. Dans cet
            environnement, la confiance <nonebreaking>est </nonebreaking>fragile. </normal>
        <normal>Dans les contextes humanitaires, les informations préjudiciables prospèrent là où la
            confiance est faible. La confiance influence fortement la propension des gens à croire,
            partager et diffuser des informations préjudiciables, ce qui détermine leur impact et
            leur portée. Les informations préjudiciables se nourrissent de la peur et de
            l&#8217;incertitude, affaiblissant les relations qui rendent possibles l&#8217;accès et
            l&#8217;action humanitaires. Sans confiance, les gens sont moins enclins à se préparer,
            à demander de l&#8217;aide ou à suivre des conseils qui peuvent leur sauver la vie.
            Lorsque la confiance existe, les communautés agissent ensemble, absorbent les chocs et
            se rétablissent plus efficacement. Maintenir la confiance n&#8217;est pas facultatif,
            c&#8217;est une <nonebreaking>nécessité </nonebreaking>humanitaire. </normal>
        <normal><regular-italic>Le Rapport sur les catastrophes dans le monde 2026 </regular-italic>appelle
            les gouvernements, les acteurs humanitaires, les médias, les entreprises technologiques
            et les communautés à reconnaître que la fiabilité de l&#8217;information est une
            question de vie ou de mort. Dans les situations d&#8217;urgence, tout comme nous
            planifions la logistique, les logements et les soins de santé, nous devons également
            planifier l&#8217;environnement informationnel. Cela nécessite d&#8217;investir dans
            l&#8217;engagement communautaire, de privilégier l&#8217;écoute plutôt que la parole, de
            renforcer la résilience face aux discours préjudiciables et de défendre systématiquement
            l&#8217;humanité, la neutralité, l&#8217;impartialité et l&#8217;indépendance dans
            chaque interaction et <nonebreaking>chaque </nonebreaking>message. </normal>
        <normal>En 2024, 32 volontaires et membres du personnel de la Croix-Rouge et du
            Croissant-Rouge ont été tués dans l&#8217;exercice de leurs fonctions ; en 2025, 27
            autres vies ont été perdues. Cela nous rappelle douloureusement les risques encourus par
            ceux qui font passer l&#8217;humanité avant tout, souvent dans les circonstances les
            plus dangereuses. Ces morts mettent en évidence la nécessité urgente de protéger le
            personnel humanitaire et les volontaires, et de préserver l&#8217;espace dont ils ont
            besoin pour sauver des vies. Tout ce qui aggrave la méfiance, alimente l&#8217;hostilité
            ou transforme l&#8217;emblème de la protection en cible doit être combattu de toute
            urgence. Si nous voulons honorer la mémoire de ceux qui ont perdu la vie, il nous faut
            faire face à cette crise avec diligence <nonebreaking>et </nonebreaking>détermination. </normal>
        <normal>L&#8217;espoir doit également faire partie de notre réponse. Les informations
            préjudiciables progressent dans la peur et la confusion, mais l&#8217;espoir, fondé sur
            la confiance, la solidarité et la dignité humaine, peut être tout aussi contagieux.
            Contrer les menaces par l&#8217;espoir et faire connaître les exemples d&#8217;action et
            les possibilités constitue un moyen d&#8217;opposition vital. Partout dans le monde, les
            communautés réagissent aux crises non seulement avec résilience, mais aussi avec
            créativité et compassion, ouvrant souvent la voie à des solutions. En diffusant les
            récits et les voix authentiques, nous faisons plus que contrer les fausses informations
            : nous encourageons l&#8217;action, nous renforçons la confiance et nous rappelons aux
            gens que même dans les moments les plus sombres, il existe des moyens d&#8217;aller <nonebreaking>
            de </nonebreaking>l&#8217;avant. </normal>
        <normal>La Fédération internationale et ses Sociétés nationales de la Croix-Rouge et du
            Croissant-Rouge membres ont toujours œuvré au cœur des communautés, dont elles ont gagné
            la confiance par leur présence, et par la transparence et le respect dont elles font
            preuve. Dans la crise de l&#8217;information que nous traversons aujourd&#8217;hui, ce
            rôle est plus important que jamais. Notre engagement est clair et inébranlable : agir
            avec humanité et sur la base de preuves, maintenir la confiance et placer les personnes
            en détresse au centre de notre action, afin que, dans les moments de peur et
            d&#8217;incertitude, les voix qui portent le plus loin soient celles qui guérissent,
            aident et protègent. Chacun d&#8217;entre nous a un rôle à jouer. En restant informés,
            en se posant des questions, en vérifiant et en diffusant uniquement ce qui est fiable et
            constructif, nous renforçons l&#8217;environnement informationnel et veillons à ce que
            l&#8217;espoir l&#8217;emporte sur la menace. </normal>
    </Story>
    <wdr-exported-hyperlinks>
    </wdr-exported-hyperlinks>
    <wdr-exported-endnote-hyperlinks>
    </wdr-exported-endnote-hyperlinks>
</Story>