<?xml version="1.0" encoding="UTF-8" standalone="no"?>
<!DOCTYPE Story SYSTEM "/Users/ylfch/Dropbox/Innovation Team/Solferino Academy/Solferino Academy 2025 - DBX/WDR25/PROD/LAYOUT/CHINESE/02_EXPORTS/DTD/04/wdr25_from_styles.dtd">
<Story>
  <Story>
    <chapter-number>前言 </chapter-number>
    <chapter-title>贾干·查普甘 </chapter-title>
    <chapter-subtitle>红十字会与红新月会国际联合会秘书长</chapter-subtitle>
    <normal>在我亲历的每场危机中——在国际红十字与红新月网络对灾害、公共卫生紧急事件、大规模人口流动或是武装冲突的人道主义后果启动的每一场响应中——信息都如同食物、水和住所般至关重要。信息指引人们走向安全，帮助他们与亲人取得联系，给予他们保护自身及社区的知识。 </normal>
    <normal>但信息也可能造成危害。当信息是虚假的、有误导性或被蓄意操纵时，就会加剧恐惧、助长歧视、阻碍人道援助准入，导致生命的代价。我们目睹过太多这样的场景：疾病暴发时，谣言的速度超过了医疗建议的传播；灾害发生后，不信任阻碍了赈济的配送；武装冲突中，煽动性的叙事使暴力升级。 </normal>
    <normal>有害信息并非新鲜事物，但如今其传播速度与覆盖范围已达到前所未有的水平。数字平台为社区发声开辟了重要渠道，却也为谎言提供了滋生的沃土。在这样的环境中，信任变得脆弱。 </normal>
    <normal>在人道主义情境中，信任薄弱之处往往滋生有害信息。信任深刻影响着人们是否相信、分享和扩散有害信息——有害信息的影响和传播范围就此形成。有害信息以恐惧和不确定性为滋养，削弱了维系人道准入和人道行动的纽带。缺乏信任时，人们更难做好危机准备、寻求援助或遵循救生指引；而信任存在时，社区便能协同行动，更有效地承受冲击并实现恢复。维护信任并非可有可无——这是人道主义的必要条件。 </normal>
    <normal>《2026年世界灾害报告》呼吁各国政府、人道行动方、媒体、科技公司及社区认识到：信息的可信度关乎生死存亡。正如我们在紧急状况中规划物流、住所和医疗服务，我们也必须为信息环境做规划。这需要投资于社区参与，优先倾听而非急于发言，建立抵御有害叙事的韧性，并在每一次互动和每一条信息中始终一贯地坚持人道、中立、公正和独立。 </normal>
    <normal>2024年，32名红十字与红新月志愿者及工作人员在执行任务时遇害；在2025年，又有27条生命逝去。这令人痛心地提醒着我们：那些将人道置于首位的人们，往往在最危险的环境中承担着巨大风险。他们的牺牲凸显出当务之急：必须保护人道工作人员和志愿者，保障他们开展救生行动所需的空间。任何加深不信任、助长敌意或将保护标志变成攻击目标的行为，都必须紧迫地直面处理。对逝者的缅怀，促使我们怀着紧迫感和决心来应对这场危机。 </normal>
    <normal>心怀希望也须成为我们应对的一部分。有害信息在恐惧与混乱中滋长，但植根于信任、团结与人类尊严的希望具有同样的感染力。在威胁与希望之间寻求平衡，培育主动性和可能性的叙事，能形成关键的制衡力量。世界各地的社区应对危机时，不仅展现出韧性，还展现出创造力和同理心，往往引领了解决方案的探索。通过放大真实的故事与声音，我们不仅能抵御虚假内容，更能激发行动、增强信任，并提醒人们：纵使身处至暗时刻，前路仍在。 </normal>
    <normal>红十字会与红新月会国际联合会及其红十字与红新月会成员始终扎根社区核心开展工作，以实际行动、透明度和尊重赢得信任。在当今的信息危机中，这一角色比以往任何时候都更为重要。我们的承诺清晰坚定：秉持人道，基于实证，捍卫信任，将有需求的人群置于首位——让恐惧与迷茫时刻，最能传遍四方的是那些治愈、援助与守护的声音。我们当中的每个人都肩负着责任。通过保持知情，提出质疑，积极核验，只扩散可信的建设性信息，我们能改善信息环境，让希望的声量盖过伤害<fig href_fmt="images/09_fmt.jpg" href="file:///Users/ylfch/Dropbox/Innovation%20Team/Solferino%20Academy/Solferino%20Academy%202025%20-%20DBX/WDR25/PROD/LAYOUT/ENGLISH/01_SOURCE/WDR26-EN-FULL-REPORT/Links/09.tif"/></normal>
  </Story>
</Story>
